{
  "schema_version": "1.0",
  "stage": "plan",
  "parent_run_id": "l2-review2-redesign-planning-run",
  "batch_id": "batch-003",
  "recorded_at": "2026-06-08T15:05:00Z",
  "child_agent_count": 2,
  "max_parallel": 2,
  "child_jobs": [
    {"job_id": "plan-t5", "result_path": "plans/gd/2026-06-08-l2-review2-redesign/packets/t5-split-commands-triage.md", "result_hash": "b47b2578edd6af7dd6cd20c6aac2543d1656f04598882eef9bcba199aa0157db", "status": "completed"},
    {"job_id": "plan-t6", "result_path": "plans/gd/2026-06-08-l2-review2-redesign/packets/t6-fix-bridge-target.md", "result_hash": "bd7a9aeb03b55f217880d86e96fc48dafdbfd992fbc21a33b21832467e4186dd", "status": "completed"}
  ],
  "main_agent_merge": {
    "merge_report_path": "plans/gd/2026-06-08-l2-review2-redesign/dispatch/merge-report.md",
    "merge_report_hash": "809865608e1fb3b7d177d6ac8474175786507b5a7700687dd03867a9129e5b38",
    "final_decision": "APPROVED",
    "blocking_buckets": []
  }
}
