{
  "schema_version": "1.0",
  "stage": "execute",
  "parent_run_id": "fix-review-chain-bugs-20260616",
  "batch_id": "batch-exec-wave1",
  "recorded_at": "2026-06-16T09:09:17Z",
  "child_agent_count": 2,
  "max_parallel": 2,
  "child_jobs": [
    {
      "job_id": "step-1-shared-p0-failclosed",
      "result_path": "plans/gd/2026-06-16-fix-review-chain-bugs/exec/results/step-1-shared-p0-failclosed.result.yaml",
      "result_hash": "418486d0d49a5f3f4659a9f0acc7ee6f347c59388d6e7afcb5130220e3ce1cf2",
      "status": "completed"
    },
    {
      "job_id": "step-3-l3-validators",
      "result_path": "plans/gd/2026-06-16-fix-review-chain-bugs/exec/results/step-3-l3-validators.result.yaml",
      "result_hash": "94c4aba7ec2665ac4378a9d9d201d24f880fda7c565e35c9829f971c640af699",
      "status": "completed"
    }
  ],
  "main_agent_merge": {
    "merge_report_path": "plans/gd/2026-06-16-fix-review-chain-bugs/exec/merge-report-wave1.md",
    "merge_report_hash": "768a31a46e601cd3e92b2c7efd361a1f64b9d66651839357431ad132c86f149a",
    "final_decision": "APPROVED",
    "blocking_buckets": []
  }
}
