{
  "schema_version": "1.0",
  "stage": "plan",
  "parent_run_id": "l2-review2-redesign-planning-run",
  "batch_id": "batch-004",
  "recorded_at": "2026-06-08T15:05:00Z",
  "child_agent_count": 2,
  "max_parallel": 2,
  "child_jobs": [
    {"job_id": "plan-t7", "result_path": "plans/gd/2026-06-08-l2-review2-redesign/packets/t7-controller-baseline-convergence.md", "result_hash": "c826d23e2af8d97157cd057d6a16474240a258e995ca4c5261487a927751f530", "status": "completed"},
    {"job_id": "plan-t8", "result_path": "plans/gd/2026-06-08-l2-review2-redesign/packets/t8-deliverable-packaging.md", "result_hash": "a664582337f753651d2c6e3fc7d00c9abe1c1524e82203028cc71db935715a32", "status": "completed"}
  ],
  "main_agent_merge": {
    "merge_report_path": "plans/gd/2026-06-08-l2-review2-redesign/dispatch/merge-report.md",
    "merge_report_hash": "809865608e1fb3b7d177d6ac8474175786507b5a7700687dd03867a9129e5b38",
    "final_decision": "APPROVED",
    "blocking_buckets": []
  }
}
