{
  "schema_version": "1.0",
  "stage": "review_plan",
  "parent_run_id": "fix-review-chain-bugs-20260616",
  "batch_id": "batch-review-post-execute-20260616",
  "recorded_at": "2026-06-16T10:05:00Z",
  "child_agent_count": 2,
  "max_parallel": 2,
  "child_jobs": [
    {
      "job_id": "review-child-A-code-correctness",
      "result_path": "plans/gd/2026-06-16-fix-review-chain-bugs/review2/claude-review-merged.json",
      "result_hash": "5f2749a9a5e5afb060397c1e6d46e84e57bf3b580d3b7d3f69b0b0d4d647e8b2",
      "status": "completed"
    },
    {
      "job_id": "review-child-B-sc-coverage",
      "result_path": "plans/gd/2026-06-16-fix-review-chain-bugs/review2/loop-report.md",
      "result_hash": "c98c1d5416e6bbc32396d140576083966eab1d301f9628c183575906fcbc1a83",
      "status": "completed"
    }
  ],
  "main_agent_merge": {
    "merge_report_path": "plans/gd/2026-06-16-fix-review-chain-bugs/review2/loop-report.md",
    "merge_report_hash": "c98c1d5416e6bbc32396d140576083966eab1d301f9628c183575906fcbc1a83",
    "final_decision": "APPROVED",
    "blocking_buckets": []
  }
}
