{
  "schema_version": "1.0",
  "stage": "execute",
  "parent_run_id": "gd-l2-parity-execute-20260609",
  "batch_id": "execute-l2-ew5",
  "recorded_at": "2026-06-09T06:30:00Z",
  "child_agent_count": 1,
  "max_parallel": 2,
  "child_jobs": [
    {
      "job_id": "child-t8",
      "result_path": "plans/gd/2026-06-08-l2-review2-redesign/results/t8-deliverable-packaging-result.md",
      "result_hash": "0804d4aa15e2a814fc4b1542e73a93fe83b973bc90e9d29fc4a5b6096f5d2943",
      "status": "completed"
    }
  ],
  "main_agent_merge": {
    "merge_report_path": "plans/gd/2026-06-08-l2-review2-redesign/dispatch/execute-merge-report.md",
    "merge_report_hash": "151b3b1a9c2559594ada59b39edcfe29aad892aff80a34c9e2150cdbb65e4783",
    "final_decision": "APPROVED",
    "blocking_buckets": []
  }
}