{
  "schema_version": "1.0",
  "stage": "plan",
  "parent_run_id": "l3-review-fusion-plan-dispatch",
  "batch_id": "batch-003",
  "recorded_at": "2026-06-09T13:30:00Z",
  "child_agent_count": 2,
  "max_parallel": 2,
  "child_jobs": [
    {
      "job_id": "plan-child-t5-regression",
      "result_path": "plans/gd/2026-06-09-l3-review-fusion/dispatch-artifacts/t5-regression-proposal.md",
      "result_hash": "2de50ff84da0a0b3bddff7c84eec2ab146b988717d442e30d61505aeb8080726",
      "status": "completed"
    },
    {
      "job_id": "plan-child-t6-deploy",
      "result_path": "plans/gd/2026-06-09-l3-review-fusion/dispatch-artifacts/t6-deploy-proposal.md",
      "result_hash": "fd1fddba1679d24b7d1f716a70f848734926fa2845723f5e0fb308e309b27dd1",
      "status": "completed"
    }
  ],
  "main_agent_merge": {
    "merge_report_path": "plans/gd/2026-06-09-l3-review-fusion/dispatch-merge-report.md",
    "merge_report_hash": "add3ca4a6f10c252f5ae0086fbab4e98ac3d8f05764a654a5f2fd1fe9cc06568",
    "final_decision": "APPROVED",
    "blocking_buckets": []
  }
}
