{
  "schema_version": "1.0",
  "stage": "plan",
  "parent_run_id": "run-eight-target-v11-fixture",
  "batch_id": "batch-002",
  "recorded_at": "2026-05-27T12:00:00Z",
  "child_agent_count": 2,
  "max_parallel": 2,
  "child_jobs": [
    {
      "job_id": "gd-v11-fixture-step-3",
      "result_path": "fixture/step-3.md",
      "result_hash": "bbbbbbbbbbbbbbbbbbbbbbbbbbbbbbbbbbbbbbbbbbbbbbbbbbbbbbbbbbbbbbbb",
      "status": "completed"
    },
    {
      "job_id": "gd-v11-fixture-step-4",
      "result_path": "fixture/step-4.md",
      "result_hash": "ffffffffffffffffffffffffffffffffffffffffffffffffffffffffffffffff",
      "status": "completed"
    }
  ],
  "main_agent_merge": {
    "merge_report_path": "fixture/merge-batch-002.md",
    "merge_report_hash": "ffffffffffffffffffffffffffffffffffffffffffffffffffffffffffffffff",
    "final_decision": "APPROVED",
    "blocking_buckets": []
  }
}
