{
  "schema_version": "1.0",
  "stage": "plan",
  "parent_run_id": "l2-review2-redesign-planning-run",
  "batch_id": "batch-001",
  "recorded_at": "2026-06-08T15:05:00Z",
  "child_agent_count": 2,
  "max_parallel": 2,
  "child_jobs": [
    {"job_id": "plan-t1", "result_path": "plans/gd/2026-06-08-l2-review2-redesign/packets/t1-exhaustive-and-dual-codex.md", "result_hash": "a14ffae0774ebaaed55efeadc4b46604dbb5cdca55e5a9512b5d186e4516f13b", "status": "completed"},
    {"job_id": "plan-t2", "result_path": "plans/gd/2026-06-08-l2-review2-redesign/packets/t2-dryrun-gate.md", "result_hash": "ec86760745a4056a34414d984cff403d6bac5ebca9f4d39db48e024ac3c8cad5", "status": "completed"}
  ],
  "main_agent_merge": {
    "merge_report_path": "plans/gd/2026-06-08-l2-review2-redesign/dispatch/merge-report.md",
    "merge_report_hash": "809865608e1fb3b7d177d6ac8474175786507b5a7700687dd03867a9129e5b38",
    "final_decision": "APPROVED",
    "blocking_buckets": []
  }
}
