{
  "schema_version": "1.0",
  "stage": "review_plan",
  "parent_run_id": "gd-plugin-packaging-plan-review-r1",
  "batch_id": "batch-002",
  "recorded_at": "2026-06-10T20:35:36Z",
  "child_agent_count": 1,
  "max_parallel": 2,
  "child_jobs": [
    {
      "job_id": "gd-plugin-packaging-plan-review-r1-subplan-track-b",
      "result_path": "/Users/praise/AI-Agent/Claude/projects/Project GD/.claude/worktrees/plugin-packaging-plan/plans/gd/2026-06-11-plugin-packaging/dispatch/review-plan-r1/mapped/gd-plugin-packaging-plan-review-r1-subplan-track-b.json",
      "result_hash": "536757bb90c8bd9e6913f5d0239b40566bc8a949dee2948ca0aa7685bffb3284",
      "status": "completed"
    }
  ],
  "main_agent_merge": {
    "merge_report_path": "/Users/praise/AI-Agent/Claude/projects/Project GD/.claude/worktrees/plugin-packaging-plan/plans/gd/2026-06-11-plugin-packaging/dispatch/review-plan-r1/controller-report.json",
    "merge_report_hash": "e827e4b4c842931b471a2a0ab957a630f84b35d638cadae399d2ab3557cd17ce",
    "final_decision": "REQUIRES_CHANGES",
    "blocking_buckets": [
      "gd-plugin-packaging-plan-review-r1-master-plan",
      "gd-plugin-packaging-plan-review-r1-subplan-track-a",
      "gd-plugin-packaging-plan-review-r1-subplan-track-b"
    ]
  }
}