{
  "schema_version": "1.0",
  "stage": "review_execution_code",
  "parent_run_id": "gd-l2-parity-review-code-20260609",
  "batch_id": "review-code-ew2",
  "recorded_at": "2026-06-09T07:00:00Z",
  "child_agent_count": 1,
  "max_parallel": 2,
  "child_jobs": [
    {
      "job_id": "review-child-round2",
      "result_path": "dispatch/review-code/review-round2-verify.md",
      "result_hash": "2336cc0792f08ec23270cced6bc9258870b8c130b95f32f561df5249fa5d5d9e",
      "status": "completed"
    }
  ],
  "main_agent_merge": {
    "merge_report_path": "/Users/praise/AI-Agent/Claude/projects/Project GD/.claude/worktrees/gd-l2-parity/dispatch/review-code/review-code-merge-report.md",
    "merge_report_hash": "692e3284e000c3c17b3333c3ed63417766ba927413fa28ae153af7a98794a971",
    "final_decision": "APPROVED",
    "blocking_buckets": []
  }
}