{
  "schema_version": "1.0",
  "stage": "plan",
  "parent_run_id": "l3-review-fusion-plan-dispatch",
  "batch_id": "batch-002",
  "recorded_at": "2026-06-09T13:30:00Z",
  "child_agent_count": 2,
  "max_parallel": 2,
  "child_jobs": [
    {
      "job_id": "plan-child-t3-review-plan",
      "result_path": "plans/gd/2026-06-09-l3-review-fusion/dispatch-artifacts/t3-review-plan-proposal.md",
      "result_hash": "b80d5e5e85413c71405461a764d2f4db3630ddb7b3195ad70ef957d58b9f5157",
      "status": "completed"
    },
    {
      "job_id": "plan-child-t4-code-path",
      "result_path": "plans/gd/2026-06-09-l3-review-fusion/dispatch-artifacts/t4-code-path-proposal.md",
      "result_hash": "8f25ff88ffea83ba195d94d6b996c7493a075054c5c0fb687012c7707ee0e57d",
      "status": "completed"
    }
  ],
  "main_agent_merge": {
    "merge_report_path": "plans/gd/2026-06-09-l3-review-fusion/dispatch-merge-report.md",
    "merge_report_hash": "add3ca4a6f10c252f5ae0086fbab4e98ac3d8f05764a654a5f2fd1fe9cc06568",
    "final_decision": "APPROVED",
    "blocking_buckets": []
  }
}
