{
  "schema_version": "1.0",
  "stage": "execute",
  "parent_run_id": "fix-review-chain-bugs-20260616",
  "batch_id": "batch-exec-wave3",
  "recorded_at": "2026-06-16T09:09:17Z",
  "child_agent_count": 1,
  "max_parallel": 2,
  "child_jobs": [
    {
      "job_id": "step-5-l2-cleanup",
      "result_path": "plans/gd/2026-06-16-fix-review-chain-bugs/exec/results/step-5-l2-cleanup.result.yaml",
      "result_hash": "288d2819442513ff32a16b93bea9b719aeb8fa36d4aee91f3029f44ae5bcf3f9",
      "status": "completed"
    }
  ],
  "main_agent_merge": {
    "merge_report_path": "plans/gd/2026-06-16-fix-review-chain-bugs/exec/merge-report-wave3.md",
    "merge_report_hash": "1e9a4e449d0507ea32cbb2c48024a62f308f0b11875e44d20d33da7505bd5575",
    "final_decision": "APPROVED",
    "blocking_buckets": []
  }
}
